[
  {
    "id": "archive-map-plovdiv-stanimaka-railway-1928",
    "kind": "map",
    "place_id": "place-plovdiv-city",
    "title_bg": "Карта на железницата Пловдив - Станимака",
    "title_en": "Map of the Plovdiv - Stanimaka railway",
    "description_bg": "Архивна карта от фонда на Българската държавна архивна агенция, използвана като стартов георефериран картографски слой за Пловдив.",
    "description_en": "Archive map from the Bulgarian Archives State Agency collection, used as a starter georeferenced cartographic layer for Plovdiv.",
    "date_year": 1928,
    "date_display_bg": "1928 г.",
    "date_display_en": "1928",
    "coordinates": {
      "lat": 42.142086,
      "lng": 24.741454,
      "accuracy": "citywide_map_reference",
      "source_place_id": "place-plovdiv-city"
    },
    "georeference": {
      "method": "map_extent_approximated_to_city",
      "confidence": "city_context",
      "notes_bg": "Картата е геореферирана към централния запис за Пловдив; точен растерен контролен слой предстои.",
      "notes_en": "The map is georeferenced to the central Plovdiv record; exact raster control points are still pending."
    },
    "overlay_bounds": {
      "south": 42.005,
      "west": 24.67,
      "north": 42.18,
      "east": 24.94,
      "method": "approximate_extent",
      "notes_bg": "Приблизителен правоъгълен обхват за визуално наслагване на картата върху съвременната основа; не е контролно-точково ректифициране.",
      "notes_en": "Approximate rectangular extent for visually overlaying the map on the modern basemap; this is not control-point rectification."
    },
    "media": {
      "type": "image",
      "title": "BASA-3K-7-334-14-Map of Plovdiv - Stanimaka railway.jpeg",
      "url": "https://upload.wikimedia.org/wikipedia/commons/b/b6/BASA-3K-7-334-14-Map_of_Plovdiv_-_Stanimaka_railway.jpeg",
      "page_url": "https://commons.wikimedia.org/wiki/File:BASA-3K-7-334-14-Map_of_Plovdiv_-_Stanimaka_railway.jpeg",
      "credit": "Unknown author",
      "license": "Public domain",
      "license_url": "https://commons.wikimedia.org/wiki/Commons:Licensing",
      "accessed_at": "2026-06-19"
    },
    "source": {
      "title": "Wikimedia Commons — BASA-3K-7-334-14-Map of Plovdiv - Stanimaka railway.jpeg",
      "url": "https://commons.wikimedia.org/wiki/File:BASA-3K-7-334-14-Map_of_Plovdiv_-_Stanimaka_railway.jpeg",
      "accessed_at": "2026-06-19",
      "license": {
        "status": "open_license",
        "label": "Public domain",
        "url": "https://commons.wikimedia.org/wiki/Commons:Licensing"
      }
    },
    "commons_categories": [
      "1928 in Bulgaria",
      "Artworks with known accession number",
      "Artworks without Wikidata item",
      "BASA-CSA-3K-7-334",
      "CC-PD-Mark",
      "History of rail transport in Bulgaria",
      "Images from the Bulgarian Archives State Agency",
      "Maps in the Bulgarian Archives State Agency",
      "Maps of Plovdiv Province",
      "PD Old",
      "Rail transport maps of Bulgaria",
      "Template Unknown (author)"
    ],
    "data_quality": "public_source",
    "editorial": {
      "status": "needs_editorial_signoff",
      "reviewed_by": null,
      "reviewed_at": null,
      "notes_bg": "Този архивен запис е автоматично подготвен от Wikimedia Commons и е показан като временна справка; независима редакторска проверка и по-точно георефериране все още предстоят.",
      "notes_en": "This archive record was automatically prepared from Wikimedia Commons and is shown as a provisional reference; independent editorial review and more precise georeferencing are still pending."
    }
  },
  {
    "id": "archive-photo-philippopolis-street-1878",
    "kind": "photo",
    "place_id": "place-old-town",
    "title_bg": "Улица във Филипопол през януари 1878 г.",
    "title_en": "Street in Philippopolis, January 1878",
    "description_bg": "Ранна фотография на улица във Филипопол/Пловдив, геореферирана към Стария град като приблизителен градски контекст.",
    "description_en": "Early photograph of a street in Philippopolis/Plovdiv, georeferenced to the Old Town as approximate urban context.",
    "date_year": 1878,
    "date_display_bg": "януари 1878 г.",
    "date_display_en": "January 1878",
    "coordinates": {
      "lat": 42.149824,
      "lng": 24.752665,
      "accuracy": "matched_place_centroid",
      "source_place_id": "place-old-town"
    },
    "georeference": {
      "method": "matched_to_existing_place_record",
      "confidence": "place_level",
      "notes_bg": "Кадърът е свързан с координатите на съществуващия запис за място: Старият град (Старинен Пловдив).",
      "notes_en": "The image is linked to the coordinates of the existing place record: The Old Town (Old Plovdiv)."
    },
    "media": {
      "type": "image",
      "title": "0530 Вид на одну из улиц Филиппополя (Пловдива), январь 1878.jpg",
      "url": "https://upload.wikimedia.org/wikipedia/commons/b/b3/0530_%D0%92%D0%B8%D0%B4_%D0%BD%D0%B0_%D0%BE%D0%B4%D0%BD%D1%83_%D0%B8%D0%B7_%D1%83%D0%BB%D0%B8%D1%86_%D0%A4%D0%B8%D0%BB%D0%B8%D0%BF%D0%BF%D0%BE%D0%BF%D0%BE%D0%BB%D1%8F_%28%D0%9F%D0%BB%D0%BE%D0%B2%D0%B4%D0%B8%D0%B2%D0%B0%29%2C_%D1%8F%D0%BD%D0%B2%D0%B0%D1%80%D1%8C_1878.jpg",
      "page_url": "https://commons.wikimedia.org/wiki/File:0530_%D0%92%D0%B8%D0%B4_%D0%BD%D0%B0_%D0%BE%D0%B4%D0%BD%D1%83_%D0%B8%D0%B7_%D1%83%D0%BB%D0%B8%D1%86_%D0%A4%D0%B8%D0%BB%D0%B8%D0%BF%D0%BF%D0%BE%D0%BF%D0%BE%D0%BB%D1%8F_(%D0%9F%D0%BB%D0%BE%D0%B2%D0%B4%D0%B8%D0%B2%D0%B0)%2C_%D1%8F%D0%BD%D0%B2%D0%B0%D1%80%D1%8C_1878.jpg",
      "credit": "Unknown author",
      "license": "Public domain",
      "license_url": "https://commons.wikimedia.org/wiki/Commons:Licensing",
      "accessed_at": "2026-06-19"
    },
    "source": {
      "title": "Wikimedia Commons — 0530 Вид на одну из улиц Филиппополя (Пловдива), январь 1878.jpg",
      "url": "https://commons.wikimedia.org/wiki/File:0530_%D0%92%D0%B8%D0%B4_%D0%BD%D0%B0_%D0%BE%D0%B4%D0%BD%D1%83_%D0%B8%D0%B7_%D1%83%D0%BB%D0%B8%D1%86_%D0%A4%D0%B8%D0%BB%D0%B8%D0%BF%D0%BF%D0%BE%D0%BF%D0%BE%D0%BB%D1%8F_(%D0%9F%D0%BB%D0%BE%D0%B2%D0%B4%D0%B8%D0%B2%D0%B0)%2C_%D1%8F%D0%BD%D0%B2%D0%B0%D1%80%D1%8C_1878.jpg",
      "accessed_at": "2026-06-19",
      "license": {
        "status": "open_license",
        "label": "Public domain",
        "url": "https://commons.wikimedia.org/wiki/Commons:Licensing"
      }
    },
    "commons_categories": [
      "CC-PD-Mark",
      "Forgotten photos of Russo-Turkish War",
      "Historical images of Plovdiv",
      "January 1878 in Europe",
      "PD-old-70-expired",
      "Streets in Plovdiv",
      "Template Unknown (author)"
    ],
    "data_quality": "public_source",
    "editorial": {
      "status": "needs_editorial_signoff",
      "reviewed_by": null,
      "reviewed_at": null,
      "notes_bg": "Този архивен запис е автоматично подготвен от Wikimedia Commons и е показан като временна справка; независима редакторска проверка и по-точно георефериране все още предстоят.",
      "notes_en": "This archive record was automatically prepared from Wikimedia Commons and is shown as a provisional reference; independent editorial review and more precise georeferencing are still pending."
    }
  },
  {
    "id": "archive-photo-plovdiv-station-around-1880",
    "kind": "photo",
    "place_id": "place-plovdiv-central-railway-station-q7205164",
    "title_bg": "Железопътната гара на Пловдив около 1880 г.",
    "title_en": "Plovdiv railway station around 1880",
    "description_bg": "Историческа снимка на железопътната гара, свързана с координатите на съвременната Централна гара.",
    "description_en": "Historical photograph of the railway station, linked to the modern Central railway station coordinates.",
    "date_year": 1880,
    "date_display_bg": "ок. 1880 г.",
    "date_display_en": "c. 1880",
    "coordinates": {
      "lat": 42.134363,
      "lng": 24.741403,
      "accuracy": "matched_place_centroid",
      "source_place_id": "place-plovdiv-central-railway-station-q7205164"
    },
    "georeference": {
      "method": "matched_to_existing_place_record",
      "confidence": "place_level",
      "notes_bg": "Кадърът е свързан с координатите на съществуващия запис за място: Централна гара Пловдив.",
      "notes_en": "The image is linked to the coordinates of the existing place record: Plovdiv Central railway station."
    },
    "media": {
      "type": "image",
      "title": "Plovdiv Train Station Around 1880.jpg",
      "url": "https://upload.wikimedia.org/wikipedia/commons/6/61/Plovdiv_Train_Station_Around_1880.jpg",
      "page_url": "https://commons.wikimedia.org/wiki/File:Plovdiv_Train_Station_Around_1880.jpg",
      "credit": "Dimitar Kavra",
      "license": "Public domain",
      "license_url": "https://commons.wikimedia.org/wiki/Commons:Licensing",
      "accessed_at": "2026-06-19"
    },
    "source": {
      "title": "Wikimedia Commons — Plovdiv Train Station Around 1880.jpg",
      "url": "https://commons.wikimedia.org/wiki/File:Plovdiv_Train_Station_Around_1880.jpg",
      "accessed_at": "2026-06-19",
      "license": {
        "status": "open_license",
        "label": "Public domain",
        "url": "https://commons.wikimedia.org/wiki/Commons:Licensing"
      }
    },
    "commons_categories": [
      "CC-PD-Mark",
      "Dimitar Kavra",
      "Historical images of Plovdiv",
      "PD Old",
      "Plovdiv Central train station"
    ],
    "data_quality": "public_source",
    "editorial": {
      "status": "needs_editorial_signoff",
      "reviewed_by": null,
      "reviewed_at": null,
      "notes_bg": "Този архивен запис е автоматично подготвен от Wikimedia Commons и е показан като временна справка; независима редакторска проверка и по-точно георефериране все още предстоят.",
      "notes_en": "This archive record was automatically prepared from Wikimedia Commons and is shown as a provisional reference; independent editorial review and more precise georeferencing are still pending."
    }
  },
  {